"104a";"GK";"";"2020-09-27_3wimi_uni-hamburg.docx";"1";"";"Hamburg";"Universität Hamburg";"Faculty of Humanities, Institute of German Language and Literature";"Ausschreibung von drei Stellen für Doktorand*innen an der Universität Hamburg im Forschungsprojekt ""Poetry in the Digital Age""";"";"";"2020-09-27";"2021-01-01";"0";"11";"";"0";"0";"0";"0";"1";"3";"0";"0";"0";"13";"";"0,5";"1";"NA";"";"1";"Kommunikationswissenschaft; Medienwissenschaft; angrenzende Disziplin";"1";"1";"Audioliterary Poetry between Performance and Mediatization";"0";"0";"";"0";"0";"";"1";"1";"research colloquia, active engagement in the project's collaborative research activities";"0";"0";"";"0";"0";"";"0";"0";"";"0";"0";"";"0";"";"1";"1";"1";"sound knowledge of academic English and/or German, affinity with and interest in contemporary cultures, poetry, and media";"1";"participation in lectrure series and workshops";"0";"1";"0";"1";"0";"0";"0";"0";"0"
"104b";"GK";"";"2020-09-27_3wimi_uni-hamburg.docx";"1";"";"Hamburg";"Universität Hamburg";"Faculty of Humanities, Institute of German Language and Literature";"Ausschreibung von drei Stellen für Doktorand*innen an der Universität Hamburg im Forschungsprojekt ""Poetry in the Digital Age""";"";"";"2020-09-27";"2021-01-01";"0";"11";"";"0";"0";"0";"0";"1";"3";"0";"0";"0";"13";"";"0,5";"1";"NA";"";"1";"Kommunikationswissenschaft";"1";"1";"Music(alization) and the Lyric: Recent Medial Correlations";"0";"0";"";"0";"0";"";"1";"1";"research colloquia, active engagement in the project's collaborative research activities";"0";"0";"";"0";"0";"";"0";"0";"";"0";"0";"";"0";"";"1";"1";"1";"sound knowledge of academic English and/or German, affinity with and interest in contemporary cultures, poetry, and media";"1";"participation in lectrure series and workshops";"0";"1";"0";"1";"0";"0";"0";"0";"0"
"104c";"GK";"";"2020-09-27_3wimi_uni-hamburg.docx";"1";"";"Hamburg";"Universität Hamburg";"Faculty of Humanities, Institute of German Language and Literature";"Ausschreibung von drei Stellen für Doktorand*innen an der Universität Hamburg im Forschungsprojekt ""Poetry in the Digital Age""";"";"";"2020-09-27";"2021-01-01";"0";"11";"";"0";"0";"0";"0";"1";"3";"0";"0";"0";"13";"";"0,5";"1";"NA";"";"1";"Kommunikationswissenschaft; Medienwissenschaft; vergleichbare Disziplin";"1";"1";"Poetry and Contemporary Visual Culture";"0";"0";"";"0";"0";"";"1";"1";"research colloquia, active engagement in the project's collaborative research activities";"0";"0";"";"0";"0";"";"0";"0";"";"0";"0";"";"0";"";"1";"1";"1";"sound knowledge of academic English and/or German, affinity with and interest in contemporary cultures, poetry, and media";"1";"participation in lectrure series and workshops";"0";"1";"0";"1";"0";"0";"0";"0";"0"
"105";"GK";"";"2020-09-27_prof_uni_klagenfurt.pdf";"2";"";"Klagenfurt";"Universität Klagenfurt";"Institut für Medien- und Kommunikationswissenschaft";"Universitätsprofessur für Medien- und Kommunikationswissenschaften";"Medien- und Kommunikationswissenschaften";"";"2020-09-27";"2021-03-01";"0";"20";"";"0";"0";"0";"0";"2";"NA";"NA";"0";"0";"30";"A1 gem. Universitäten-Kollektivvertrag (derzeit 73.450,- brutto jährlich)";"1";"0";"NA";"";"1";"Kommunikationswissenschaft; Politikwissenschaft; Psychologie; verwandte Sozialwissenschaft";"1";"1";"Medien- und Kommunikationswissenschaften";"0";"0";"";"0";"0";"";"1";"1";"Mitwirkung in den Bachelor- und masterstudien des Instituts, hervorragende Forschung im Bereich Medien- und Kommunikationswissenschaft in den Schwerpunktbereichen Mediatisierung und Medienbildung Im Kontext der Digitalisierung";"1";"0";"Erfahrung in der Konzeption und Durchführung von Drittmittelprojekten";"0";"0";"";"1";"1";"Vertretung des Faches in Lehre, insbesondere in den Bereichen Mediatisierung sowie Medienbildung im Kontext der Digitalisierung; organisatorisch-koordinierendee verantwortliche Mitbetreuung des Fachs, hervorragende Lehre im Bereich Medien- und Kommunikationswissenschaft in den Schwerpunktbereichen Mediatisierung und Medienbildung Im Kontext der Digitalisierung";"1";"1";"Beratung und Betreuung von Studierenden, insbesondere die Betreuung von Bachelorarbeiten, Masterarbeiten und Dissertationen, Beratung und Förderung des wissenschaftlichen Nachwuchses, nachgewiesene universitäte Lehrerfahrung und hochschuldidaktische Kompetenz";"";"";"1";"1";"1";"Führungskompetenz und Teamfähigkeit, Bereitschaft zur Weiterentwicklung des Fachs, Erfahrungen in der internationales Forschungskooperation und Einbettung in die internationale Forschungslandschaft, internationale Forschungs- und Publikationsleistung, Fähigkeit und Bereitschaft zur Leitung einer Organisationseinheit, Bereitschaft und Fähigkeit zu interdisziplinärer Kooperation, Kompetenz im bereich Gender Mainstreaming und Diversity Management, innovative Ansätze in der Entwicklung und Vermittlung von Theorien und Methoden";"1";"Mitwirkung an der curricularen Entwicklungs- und Evaluationsarbeit, Mitwirkung an der Profilbildung des Instituts, Mitwirkung im Doktoratsttudium sowie an der Entwicklung und Implementierung von Doktoratsprogrammen. Mitwirkung an der Profilbildung des Instituts, Mitwirkung im Universitätsmanagement";"0";"1";"1";"1";"0";"0";"0";"0";"2"
"106";"GK";"";"2020-09-27_w2_uni_muenster.pdf";"1";"";"Münster";"Universität Münster";"Institut für Kommunikationswissenschaft, Fachbereich 06- Erziehungswisseneschaft und Sozialwissenschaft";"W2-Professur für Kommunikationswissenschaft (mit dem Schwerpunkt ""Journalismusforchung"")";"Kommunikationswissenschaft mit dem Schwerpunkt Journalismusforschung";"";"2020-09-27";"asap";"1";"23";"";"0";"0";"0";"0";"2";"NA";"NA";"0";"0";"2";"";"1";"0";"NA";"";"0";"Kommunikationswissenschaft; verwandte Sozialwissenschaft; Politikwissenschaft";"1";"1";"Journalismusforschung und Kommunikationswissenschaft";"0";"0";"";"0";"0";"";"1";"1";"Forschung im Fach Kommunikationswissenschaft, theoretische und empirische Analyse des Journalismus auf Mikro-, Meso- und Makro-Ebene, Forschungstätigkeiten im bereich Journalismusforschung, Mitarbeit an einem aufzubauenden Forschungsschwerpunkt Wissenschaftskommunikation";"1";"1";"Erfahrung mit der Akquise und Durchführung von Drittmittelprojekten";"0";"0";"";"1";"1";"hohes Engagement in der akademischen Lehre, Mitwirkung an B.A.-/ M.A.-Studiengängen, Vertretung mehrerer Schwerpunkte der modularisierten Studiengänge, Lehr - und Prüfungserfahrung";"0";"0";"";"0";"";"1";"1";"1";"Bereitschaft zur englischen Lehre";"0";"";"0";"1";"1";"1";"0";"0";"1";"0";"0"
"107";"GK";"";"2020-09-30_postdoc_uni_klagenfurt.pdf";"2";"";"Klagenfurt";"Universität Klagenfurt";"";"Senior Scientist ohne Doktorat (w/m/d)";"";"";"2020-09-30";"2021-03-01";"0";"11";"Senior Scientist ohne Doktorat";"0";"0";"0";"0";"1";"3";"0";"0";"0";"30";"2.196,80 (14x jährlich) bis zu 2.604,30 brutto";"0,75";"0";"NA";"";"1";"Kommunikationswissenschaft; verwandte Sozialwissenschaft; Politikwissenschaft";"1";"1";"Roboterethik";"1";"1";"Methodenkenntnisse im Bereich der qualitativen Sozialforschung";"0";"0";"";"1";"1";"Kenntnisse bzw. Erfahrungen im Bereich inter- und transdisziplinärer Forschung, Forschung und wissenschaftliche Qualifikation innerhalb des Karl Popper Kollegs mit dem Zeil einer Dokotrarbeit";"0";"0";"";"0";"0";"";"0";"0";"";"0";"0";"";"1";"fachspezigische Auslands- und Praxiserfahrungen";"1";"1";"1";"gute Englisch- und Deutschkenntnisse in Wort und Schrift, Fundierte Kenntnisse auf mindestens einem der folgenden Forschungsgebiete: Medien und Kommunikationsethik Roboterethik/ Ethik der Digitalisierung/ Technikethik/ Ingenieursethik, Ethik-Ansatz und -modelle; Kommunikations- und Präsentationsfähigkeiten, Interesse an der interdisziplinären Bearbeitung von Fragestellungen des Kollegs,";"1";"Präsentation wissenschaftlicher Ergebnisse in Publikationen und auf Konferenzen, enge interdisziplinäre Zusammenarbeit mit internationalen KoomperationspartnerInnen und Personen in anderen Teilprojekten des Kollegs, in den bereich Psychologie, Roboterethik, Softwareentwicklung und Sicherheit";"0";"1";"1";"1";"0";"0";"0";"0";"2"
"108";"GK";"";"2020-09-30_praedoc1_uni_hamburg.pdf";"1";"";"Hamburg";"Universität Hamburg";"Fakultät für Wirtschafts- und Sozialwissenschaften";"Wissenschaftliche Mitarbeiterin bzw. wissenschaftlicher Mitarbeiter (m/w/d) im Fachgebiet Journalistik und Kommunikationswissenschaft";"";"";"2020-09-30";"2020-12-01";"0";"11";"";"0";"0";"0";"0";"1";"3";"0";"0";"0";"13";"";"0,75";"0";"3";"";"1";"Psychologie; Wirtschaftspsychologie";"0";"1";"Lehre und Entwicklung einer Doktorarbeit im Bereich Journalistik und Kommunikationswissenschaft im digitalen Kontext";"1";"0";"exzellente Kenntnisse in empirischen Methoden der Sozialforschung (insbesondere Erfahrung mit ethnographischen Methoden, Befragungen und/oder Inhaltsanalysen";"1";"1";"gute Grundlagen in Statistik sowie SPSS,Stata, Affinität und Interesse für das Erlernen von Computational Methods der Kommunikationswissenschaft";"1";"1";"wissenschaftliche Dienstelstungen in der Forschung im Gebiet Journalistik und Kommunikationswissenschaft im digitalen Kontext, KOnzeption und Durchführung von Forschung im team";"1";"1";"Mitwirkung bei der Ausarbeitung von Drittmittelanträgen";"0";"0";"";"1";"1";"wissenschaftliche Dienstelstungen in der Lehre im Bereich Journalistik und Kommunikationswissenschaft im digitalen Kontext, Planung und Durchführung von Lehrveranstaltungen";"1";"1";"Unterstützung bei der Organisation des Arbeitsvereiches und Beteiligung an der universitären Selbstverwaltung";"1";"praktische Erfahrung im (Online-)Journalismus";"1";"1";"1";"exzellente Englischkenntnisse, organisatorische Fähigkeiten in der Projektleitung, ausgeprägte soziale Kompetenzen, Teamfähigkeit, Zuverlässigkeit und eine hohe Arbeitsmotivation";"1";"Entwicklung einer Doktorarbeit, Beteiligung bei Publikationen, Präsentationen und Konferenzen";"0";"1";"1";"1";"0";"0";"0";"0";"0"
"109";"GK";"";"2020-09-30_praedoc2_uni_hamburg.pdf";"1";"";"Hamburg";"Universität Hamburg";"Fakultät für Wirtschafts- und Sozialwissenschaften";"Wissenschaftliche Mitarbeiterin bzw. wissenschaftlicher Mitarbeiter (m/w/d) im Fachgebiet Journalistik und Kommunikationswissenschaft";"";"";"2020-09-30";"2020-12-01";"0";"11";"";"0";"0";"0";"0";"1";"3";"0";"0";"0";"13";"";"0,75";"0";"3";"";"1";"Publizistik; Medienwissenschaft; Kommunikationswissenschaft";"0";"1";"Journalistik und Kommunikationswissenschaft im digitalen Kontext; Recommender Systeme für Nachrichten";"1";"0";"exzellente Kenntnisse in empirischen Methoden der Sozialforschung (insbesondere Erfahrung mit ethnographischen Methoden, Befragungen und/oder Inhaltsanalysen";"1";"1";"gute Grundlagen in Statistik sowie SPSS,Stata, Affinität und Interesse für das Erlernen von Computational Methods der Kommunikationswissenschaft";"1";"1";"wissenschaftliche Dienstelstungen in der Forschung im Gebiet Journalistik und Kommunikationswissenschaft im digitalen Kontext, KOnzeption und Durchführung von Forschung im team";"1";"1";"Mitwirkung bei der Ausarbeitung von Drittmittelanträgen";"0";"0";"";"1";"1";"wissenschaftliche Dienstelstungen in der Lehre im Bereich Journalistik und Kommunikationswissenschaft im digitalen Kontext, Planung und Durchführung von Lehrveranstaltungen";"1";"1";"Unterstützung bei der Organisation des Arbeitsvereiches und Beteiligung an der universitären Selbstverwaltung";"1";"praktische Erfahrung im (Online-)Journalismus";"1";"1";"1";"exzellente Englischkenntnisse, organisatorische Fähigkeiten in der Projektleitung, ausgeprägte soziale Kompetenzen, Teamfähigkeit, Zuverlässigkeit und eine hohe Arbeitsmotivation";"1";"Entwicklung einer Doktorarbeit, Beteiligung bei Publikationen, Präsentationen und Konferenzen";"0";"1";"1";"1";"0";"0";"0";"0";"0"
"110";"GK";"";"2020-09-30_prof_uni_insbruck.pdf";"2";"";"Innsbruck";"Universität Inssbruck";"Instiut für Medien, Gesellschaft und Kommunikation, Fakultät für Soziale und Politische Wissenschaften";"Universitätsprofessorin/Universitätsprofessor für Medien- und Kommmunikationswissenschaft mit dem Schwerpunkt Demokratie";"Medien- und Kommmunikationswissenschaft mit dem Schwerpunkt Demokratie";"";"2020-09-30";"";"0";"20";"";"0";"0";"0";"0";"2";"NA";"NA";"0";"0";"30";"A1 (5.245,60 €/Monat (14x))";"1";"0";"NA";"";"0";"Kommunikationswissenschaft; angrenzende Sozialwissenschaft";"1";"1";"Erforschung der Rolle von Medien und Kommunikation für die Demokratie und Demokratieentwicklung unter Bedingungen wie Medialisierung, Digitalisierung und globalisierung";"0";"0";"";"0";"0";"";"1";"1";"international sichtbare Forschungen, Durchführung kompetitiv eingeworbener Forschungsprojekte, Beteiligung am universitären Forschungsschwerpunktsystem, Einbindung in die internationale Forschung";"1";"0";"erfolgreiche Einwerbung von Forschungsmitteln";"0";"0";"";"1";"1";"Lehre im Bereich der medien- und kommunikationswissenschaftlichen Lehrveranstaltungen, Lehre ergänzen im Bereich politischer Kommunikation der politikwissenschaftlichen Studiengänge, Lehrerfahrung";"1";"1";"akademische Selbstverwaltung";"0";"";"1";"1";"1";"einschlägige Lehrbefugnis; hochwertige, facheinschlägige Aufsätze in führenden internationalen referierten; ausgeprägte pädagogische und didaktische Eignung, Zeitschriften und Buchpublikationen in referierten wissenschaftlichen Verlagen; nachgewiesene Fähigkeiten zu Verknüpfung von medien- und kommunikationswissenschaftlicher Theorie und empirischer Forschung des beschriebenen Forschungsschwerpunkts; soziale Kompetenz und Teamfähigkeit; sehr gute Deutsch- und Englischkenntnisse";"1";"Mitarbeit an der strategischen Weiterentwicklung und der internationalen Vernetzung des Insituts";"0";"0";"0";"1";"0";"0";"0";"0";"0"
"111";"GK";"";"2020-10-01_postdoc_uni_hamburg.pdf";"1";"";"Hamburg";"Universität Hamburg";"Fakultät für Wirtschafts- und Sozialwissenschaften";"Ausschreibung eines Werkvertrags zur Inhaltsanalyse (Print/Online)";"";"2020-08-11";"2020-10-01";"2020-11-01";"0";"30";"Honorarauftrag";"0";"0";"0";"0";"1";"NA";"NA";"0";"0";"30";"Werkauftragshonorar, Verhandlungen";"NA";"1";"NA";"";"0";"Publizistik; Kommunikationswissenschaft; verwandte empirisch orientierte sozialwissenschaftliche Disziplin";"1";"0";"Qualitätsjournalismus und digitale Medien";"1";"1";"quantitative und qualitative Inhaltsanalyse";"0";"0";"";"0";"0";"";"0";"0";"";"0";"0";"";"0";"0";"";"0";"0";"";"0";"";"0";"0";"0";"";"0";"";"0";"0";"0";"0";"0";"0";"0";"0";"0"
"112";"GK";"";"2020-10-01_praedoc_hiig_berlin.pdf";"1";"";"Berlin";"Humboldt Institut für Internet und Gesellschaft";"Institut für Internet und Gesellschaft";"Doktorand*innen (m/w/d) mit technischer Perspektive";"";"2020-06-18";"2020-10-01";"2021-01-01";"0";"11";"";"0";"1";"0";"0";"1";"3";"9";"0";"0";"13";"";"0,75";"1";"NA";"";"1";"Politikwissenschaft; Sozialwissenschaft; Kommunikationswissenschaft";"1";"1";"Natural Languague Processing; Computer Vision";"0";"0";"";"0";"0";"";"1";"1";"Mitwirkung an der Entwicklung interdisziplinärer Forschungs- und Formate für Expert*innen-Workshops und Wissenstranfer";"0";"0";"";"0";"0";"";"0";"0";"";"0";"0";"";"0";"";"1";"1";"1";"praktische bzw. wissenschaftliche Erfahrungen im Feld der KI Anwendung (insb. Machine Learning/Deep Learning) und/oder im Bereich NLP, Interesse an disziplinübergreifender Forschung woei die Fähigkeit, Anknüpfungspunkkte zu anderen Fachgebieten zu identifizieren und zu nutzen, strategisches Denken und Organisationstalent, überdurchschnittlich hohes Maß an Freude an der interdisziplinären Zusammenarbeit, Eigenständigkeit, Gestaltungswillen, Verantwortungsbewusstsein, Motivation und Teamfähigkeit, Verhandlungssichere Deutsch- und Englischkenntnisse";"1";"Entwicklung von Prototypen in Zusammenarbeit mit zivilgesellschaftlichen Praxispartnern, Mitarbeit an der Entwicklung eines interdisziplinären und anwendungsorientierten Gemeinwohlkonzeptes in enger Abstimmung mit der Projektleiterin und der Post-Doktorandin";"Mitwirkung an der Entwicklung und Etablierung eines neuen Forschungprojektes mit Raum für eigene Ideen und neue Formate in Zusammenarbeit mit der Projektleiterin sowie in enger Abstimmung mit dem Forschungsdirektorium in einem anerkannten, innovativen Forschungsinstituts; Unterstützung im Aufbau des kürlich gegründeten AL / Society Labs; exzellente Position, um die eigene Forschungskariiere zu starten, eigene Initiativen zu entwickeln und perspektivisch Einfluss auf laufende Debatten um KI zu nehmen; die Möglichkeit zur Promotion, die Teilnehme am Doktoranden- sowie am promotionsbegleitenden Mentor*innen-Programm und weitere hervorragende (fachliche) Austausch- und Netzwerkmöglichkeiten; die Möglichkeit, Teil einer Forschungsgruppe zu werden, die sich explizit für die Qualifizierung und Förderung von Frauen in der KI-Forschung stark macht, ein attraktives und familienfreundliches Arbeitsumfeld mit flexiblen Arbeitszeiten, flachen Hierarchien in eiem gelebten Gegenentwurf zum traditionallen Wissenschaftsbetrieb; ein hochmitiviertes Team, das sehr eng zusammenarbeitet sowie engagierte Kollegen*innen aus verschiedenen Disziplinen in einem zukunftsweisenden Inistut mitten in Berlin";"1";"0";"1";"0";"1";"0";"0";"0"
"113";"GK";"";"2020-10-01_praedoc2_hoog_berlin.pdf";"1";"";"Berlin";"Alexander-Humboldt Universität Berlin";"Institut für Internet und Gesellschaft";"Doktorand*in (m/w/d) mit Design/ UX-Hintergrund";"";"2020-06-18";"2020-10-01";"2021-01-01";"0";"11";"";"0";"1";"0";"0";"1";"3";"9";"0";"0";"13";"";"0,75";"1";"NA";"";"1";"Jurnalismus; Medienwissenschaft; Kommunikationswissenschaft; verwandte Disziplin";"1";"1";"KI und UX; Public Interest AI";"0";"0";"";"0";"0";"";"1";"1";"Unterstützung beim Aufbau des Forschungsprojektes zu Public Interest Al, Mitwirkung an der Entwicklung interdisziplinärer Forschungs- und Formate für Expert*innen-Workshops und Wissenstranfer";"0";"0";"";"0";"0";"";"0";"0";"";"0";"0";"";"0";"";"1";"1";"1";"praktische bzw. wissenschaftliche Erfahrungen im Feld Design/ UX; Interesse an der Mitarbeit an KI-Projekten z.B. in den Bereichen Machine Learning/Deep Learning und NLP, Interesse an disziplinübergreifender Forschung sowie die Fähigkeit, Anknüpfungspunkte zu anderen Fachgebieten zu identifizieren und zu nutzen, strategisches Denken und Organisationstalent, überdurchschnittlich hohes Maß an Freude an der interdisziplinären Zusammenarbeit, Eigenständigkeit, Gestaltungswillen, Verantwortungsbewusstsein, Motivation und Teamfähigkeit, Verhandlungssichere Deutsch- und Englischkenntnisse";"1";"Mitwirkung an der Entwicklung interdisziplinärer Forschungs- und Workshop-Formate für Expert*innen-Workshops und Formate des Wissenstransfers, Mitarbeit an der Entwicklung eines interdisziplinären und anwendungsorientierten Gemeinwohlkonzeptes in enger Abstimmung mit der Projektleiterin und der Post-Doktorandin, Untersuchung von Praxisfällen bei Projektparntern zur Entwicklung eines UX-Modells zur Umsetzung von gemeinwohlorientierung in KI";"Mitwirkung an der Entwicklung und Etablierung eines neuen Forschungprojektes mit Raum für eigene Ideen und neue Formate in Zusammenarbeit mit der Projektleiterin sowie in enger Abstimmung mit dem Forschungsdirektorium in einem anerkannten, innovativen Forschungsinstituts; Unterstützung im Aufbau des kürlich gegründeten AL / Society Labs; exzellente Position, um die eigene Forschungskariiere zu starten, eigene Initiativen zu entwickeln und perspektivisch Einfluss auf laufende Debatten um KI zu nehmen; die Möglichkeit zur Promotion, die Teilnehme am Doktoranden- sowie am promotionsbegleitenden Mentor*innen-Programm und weitere hervorragende (fachliche) Austausch- und Netzwerkmöglichkeiten; die Möglichkeit, Teil einer Forschungsgruppe zu werden, die sich explizit für die Qualifizierung und Förderung von Frauen in der KI-Forschung stark macht, ein attraktives und familienfreundliches Arbeitsumfeld mit flexiblen Arbeitszeiten, flachen Hierarchien in eiem gelebten Gegenentwurf zum traditionallen Wissenschaftsbetrieb; ein hochmitiviertes Team, das sehr eng zusammenarbeitet sowie engagierte Kollegen*innen aus verschiedenen Disziplinen in einem zukunftsweisenden Inistut mitten in Berlin";"1";"0";"1";"0";"1";"0";"0";"0"
"114";"GK";"";"2020-10-12_praedoc_uni_zuerich.pdf";"3";"";"Zürich";"Universität Zürich";"Institut für Kommunikationswissenschaft und Medienforschung";"Stellenausschreibung Doktorand*in im Bereich Mediennutzung & Medienwirkung";"";"2020-09-24";"2020-10-12";"2021-01-01";"0";"11";"";"0";"1";"0";"0";"1";"4";"0";"1";"2";"30";"Lohnklasse 17/ Leistungsstufe 3";"0,6";"1";"NA";"";"1";"Sozialwissenschaftliche Disziplin; Informatik";"0";"1";"Digital Religions";"0";"1";"sehr gute Kenntnisse quantitativer Forschungsmethoden";"0";"0";"";"1";"1";"Forschung mit dem Schwerpunkt sozialer Kontext der Mediennutzung und -wirkung, Vorkenntnisse bzw. hohes Interesse an Mediennutzungs- und Medienwirkungsforschung";"0";"0";"";"0";"0";"";"0";"0";"";"0";"0";"";"0";"";"1";"1";"1";"sehr gute Deutsch- und Englischkenntnisse, sehr gute Kenntnisse kommunikationswissenschaftlicher Theorien";"1";"Konferenzteilnahme und Publikationen, Mitarbeit im Projekt, Teilnehme an der Doktorandenausbildung im Rahmen des UFSP";"inspirierendes akademisches Umfeld, ausgezeichnete anstellungsbedingungen, zahlreiche Möglichkeiten zur Weiterbildung, vielfältige interdisziplinäre Kooperationsmöglichkeiten";"0";"0";"0";"0";"0";"0";"0";"0"
"115";"GK";"";"2020-10-23_praedoc2_uni_zuerich.pdf";"3";"";"Zürich";"Universität Zürich";"Institut für Kommunikationswissenschaft und Medienforschung";"Assistent/in in Forschung und Lehre 60% (Doktoriendenstelle)";"";"";"2020-10-23";"asap";"1";"11";"";"0";"0";"0";"0";"0";"NA";"NA";"0";"0";"0";"";"1";"0";"NA";"";"1";"Kommunikationswissenschaft; Medienwissenschaft; Kommunikationsmanagement; Marketing/vertrieb";"1";"1";"International and Comparative Communications Research";"1";"0";"Erfahrung mit quantitativen Methoden und Datenanalyse, Interesse an computergestützten Methoden";"0";"0";"";"1";"1";"starkes Interesse an international vergleichender Kommunikationsforschung, Mitarbeit in bestehenden Projekten und Entwicklung neuer Projekte mit Mitgliedern des Teams ""Internationale und vergleichende KOmmunikationsforschung"", Forschung in innovativen Bereichen der politischen Kommunikation, des digitalen Journalismus, der Nachrichtenpublikationsforschung sowie ähnlicher angrenzender Gebiete";"0";"0";"";"0";"0";"";"1";"1";"Lehre in innovativen Bereichen der polititischen Kommunikation, des digitalen Journalismus, der Nachrichtenpublikationsforschung sowie ähnlicher angrenzender Gebiete, Unterricht in Deutsch auf BA-Niveau";"0";"0";"";"0";"";"1";"1";"1";"fließendes Englisch";"1";"Abschluss einer Dissertation in drei bis vier Jahren";"0";"0";"0";"0";"0";"0";"0";"0";"0"
"116";"GK";"";"2020-10-25_praedoc_fh_graubünden.pdf";"3";"";"Graubünden";"Fachhochschule Graubünden";"";"Wissenschaftliche/n Mitarbeiter/in";"";"";"2020-10-25";"asap";"1";"11";"";"0";"1";"0";"0";"1";"3";"6";"0";"0";"30";"Entlohnung entspricht den offiziellen Ansätzen des SNF";"1";"1";"NA";"";"1";"Medienwissenschaft; Kommunikationswissenschaft";"1";"1";"Local Journalism and Municipal Communication under Digital Transformation
";"1";"1";"sehr gute Kenntnisse von qualitativen und quantitativen Forschungsmethoden";"0";"0";"";"1";"1";"Mitarbeit am SNF-Projekt; ausführen von Datenerhebungen und Datenauswertung; aufbereiten der Forschungsergebnisse";"0";"0";"";"0";"0";"";"0";"0";"";"0";"0";"";"0";"";"1";"1";"1";"Teamfähigkeit und Freude an interdisziplinärer Zusammenarbeit, gute Französisch- und Englischkenntnisse (Italienisch wünschenswert)";"1";"Konferenzbeiträge und Publikationen der Forschungsergebnisse";"intellektuell inspirierendes Umfelt mit vielfältigen Bezügen zur Medienpraxis und Politik";"1";"0";"0";"1";"0";"0";"0";"0"
"117";"GK";"";"2020-10-25_w1_uni_muenster.pdf";"1";"";"Münster";"Universität Münster";"Institut für Kommunikationswissenschaft des Fachbereiches 06- Erziehungswissenschaft und Sozialwissenschaft";"W1-Professur für Kommunikationswissenschaft mit dem Schwerpunkt Digital Media and Computational Methods (mit Tenure Track)";"Kommunikationswissenschaft mit dem Schwerpunkt Digital Media and Computational Methods";"";"2020-10-25";"asap";"1";"21";"";"1";"0";"0";"0";"1";"NA";"NA";"0";"0";"1";"";"1";"0";"NA";"";"0";"Politikwisenschaft; Kommunikationswissenschaft; verwandten Disziplin";"1";"1";"Kommunikationswissenschaft mit computergestützten Methoden";"1";"1";"computergestützten Methoden der Kommunikationswissenschaft, Anwendung der Methoden zur Erhebung, Analyse und Darstellung kommunikationswissenschaftlicher Prozesse anhand großer Datenmengen";"0";"0";"";"1";"1";"Teilnehmen an Forschungsaktivitäten, aktive Beteiligung am Zentrum zur Erforschung digitalisierter Öffentlichkeit";"1";"1";"eigene Erfahrung in der Durchführung von Drittmittel- bzw. Forschungsprojekten";"0";"0";"";"1";"1";"hohes Engagement in der akademichen Lehre, Mitwirkung an den B.A.-/M.A.-Studiengängen, Bereitschaft Lehrveranstaltungen in Englisch durchzuführen, Lehr- und Prüfungserfahrung";"0";"0";"";"0";"";"1";"1";"1";"pädagogische Eignung, besondere Befähigung zu wissenschaftlicher Arbeit durch die Qualität der Promotion";"0";"";"0";"1";"1";"1";"0";"0";"0";"0";"0"
